Ball,Ball Number,Bowler,Batsman,Runs,is_wicket,bowler_good,Description,match_id,city,total_runs,over,ball_in_over,continuous_ball_index,overs_bowled,overs_completed,balls_in_current_over,actual_over_ball,is_original_ball_number,current_run_rate,total_overs,target,runs_needed,overs_remaining,required_run_rate,wickets_fallen,wickets_in_hand
53,8.5,Mukesh Kumar,B Sai Sudharsan,4,False,0,"All timing that. Length ball outside off, it is the slower one. Sudharsan hops and slaps it through covers to beat sweeper to his left.",7,Delhi,141,8,5,101,17.0,16,6,16.6,True,8.294117647058824,20,163,22,3.0,7.333333333333333,4,6
54,8.6,Mukesh Kumar,B Sai Sudharsan,0,False,1,"Back of a length outside off, he lets it be.",7,Delhi,141,8,6,102,17.166666666666668,17,1,17.1,True,8.213592233009708,20,163,22,2.833333333333332,7.764705882352945,4,6
55,9.1,Kuldeep,Shankar,0,False,1,"Floats it fullish and outside off, it is the wrong one. Vijay plays inside the line and gets beaten on the outside.",7,Delhi,141,9,1,103,17.333333333333332,17,2,17.2,True,8.134615384615385,20,163,22,2.666666666666668,8.249999999999996,4,6
56,9.2,Kuldeep,Shankar,4,False,0,"Smacked it alright!Very full and outside off, it is the traditional legbreak. Vijay clears his front leg and hits it over the bowler's head.",7,Delhi,145,9,2,104,17.5,17,3,17.3,True,8.285714285714286,20,163,18,2.5,7.2,4,6
57,9.3,Kuldeep,Shankar,1,False,0,"Goes back, it is a touch short and low, hits it with the turn to deep square leg.",7,Delhi,146,9,3,105,17.666666666666668,17,4,17.4,True,8.264150943396226,20,163,17,2.333333333333332,7.285714285714289,4,6
58,9.4,Kuldeep,B Sai Sudharsan,2,False,0,"Lands it on a length on off, turns away. Sudharsan goes back and works it through midwicket.",7,Delhi,148,9,4,106,17.833333333333332,17,5,17.5,True,8.299065420560748,20,163,15,2.166666666666668,6.923076923076919,4,6
59,9.5,Kuldeep,B Sai Sudharsan,1,False,0,"Full on middle and leg, plays it with soft hands towards midwicket. Kuldeep himself gets to it and keeps it to one.",7,Delhi,149,9,5,107,18.0,17,6,17.6,True,8.277777777777779,20,163,14,2.0,7.0,4,6
60,9.6,Kuldeep,Shankar,1,False,0,"Full on middle and leg, pats it to the on side for a quick one.",7,Delhi,150,9,6,108,18.166666666666668,18,1,18.1,True,8.256880733944953,20,163,13,1.8333333333333321,7.090909090909095,4,6
